poiID,starSite,xmlID,city,Image to include,SEO file name,number,source,photographer,agency description,credit,caption,type,labelID,cutawayNumber,title,description,imageID,highlights,imageName,leftPosition,topPosition,info
,Museo Arqueológico Nacional,,madrid,,museo_arqueol_gico_nacional_south_patio_madrid,,,Luis Asín,Roman Forum Room,&#169;Museo Arqueológico Nacional/Luis Asín,,gallery,,,South Patio,<p>Roman busts on display on the South Patio of the&nbsp;Museo Arqueol&oacute;gico Nacional.</p>,,,,,,
,,,,,,,,,,,,,,,,,,,,,,
,Museo Lázaro Galdiano,EWTG_MADRID102MUSLAZ_007,madrid,TRUE,museo_lazaro_galdiano_st_john_baptist_madrid_museo_lazaro_galdiano_8155,8155,Museo Lazaro Galdiano,,HIERONYMUS BOSCH: Meditaciones de San Juan Bautista. Fines del s.XV | Óleo sobre tabla | Inv. 8155,"&#169;Lázaro Galdiano Foundation Museum, Madrid",,gallery,,,<em>St John the Baptist</em> (c.1485–1510) by Hieronymus Bosch,"<p>Surrounded by the lamb of spiritual life and other allegorical animals and birds, Hieronymus Bosch&rsquo;s contemplative <em>St John the Baptist</em> (c.1485&ndash;1510) reclines in an almost pastoral landscape punctuated by grotesque plants.</p>",,,,,,asked flg.comunicacion@flg.es
,Museo Lázaro Galdiano,EWTG_MADRID102MUSLAZ_013,madrid,TRUE,museo_lazaro_galdiano_portrait_a_lady_madrid_museo_lazaro_galdiano_1518,1518,Museo Lazaro Galdiano,,"JUAN CARREÑO DE MIRANDA: Retrato de Doña. Inés de Zúñiga, condesa de Monterrey. Hacia 1660-1670 | óleo sobre lienzo| Inv. 1518","&#169;Lázaro Galdiano Foundation Museum, Madrid",,gallery,,,<em>Inés de Zúñiga</em> (c.1660–70) by Juan Carreño de Miranda,<p>This painting of the Countess of Monterrey was executed by Juan&nbsp;Carre&ntilde;o de Miranda in the late 17th century. She is dressed in a wide Spanish farthingale.</p>,,,,,,asked flg.comunicacion@flg.es
,Museo Lázaro Galdiano,EWTG_MADRID102MUSLAZ_009,madrid,TRUE,museo_lazaro_galdiano_crosier_head_madrid_museo_lazaro_galdiano_3201,3201,Museo Lazaro Galdiano,,Báculo abacial. Hacia 1200| Esmaltes. Taller de de Limoge | Inv. 3201,"&#169;Lázaro Galdiano Foundation Museum, Madrid",,gallery,,,Crosier Head,<p>This beautiful gilded and enamelled object was made in Limoges in the 13th century for the top of a bishop&rsquo;s staff (crosier). It is decorated with stylized plants.</p>,,,,,,asked flg.comunicacion@flg.es
,,,,,,,,,,,,,,,,,,,,,,
,Plaza Mayor,TT_MADRID018PLAMAY_001,madrid,TRUE,plaza_mayor_statue_felipe_iii_madrid_dk_al384355,AL384355,dk,,,&#169;dkimages,,gallery,,,Statue of Felipe III,"<p>This magnificent statue by two Italian artists, Pietro Tacca and Giambologna, was moved here in the 19th century. Presented to Felipe III in 1616 by the Florentine ruler Cosimo de&rsquo; Medici, it was originally in the Casa de Campo.</p>",,,,,,
,Plaza Mayor,TT_MADRID018PLAMAY_002,madrid,TRUE,plaza_mayor_casa_la_panader_madrid_dk_al1045807,AL1045807,dk,,,&#169;dkimages,,gallery,,,Casa de la Panadería,"<p>This house was the headquarters of the bakers&rsquo; guild, which had enormous power controlling the price of grain. The portal survives from the original building which burned down in 1672.</p>",,,,,,
,Plaza Mayor,TT_MADRID018PLAMAY_009,madrid,TRUE,plaza_mayor_lampposts_madrid_dk_al206087,AL206087,dk,,,&#169;dkimages,,gallery,,,Lampposts,"<p>The lampposts around the statue of Felipe III are engraved with scenes depicting life on the square in days gone by. They include a masquerade ball, an interrogation by members of the Inquisition and a bullfight.</p>",,,,,,
,Plaza Mayor,TT_MADRID018PLAMAY_004_R13,madrid,TRUE,plaza_mayor_casa_la_carnicer_madrid_dk_al1045807,AL483263,dk,,,&#169;dkimages,,gallery,,,Casa de la Carnicería,<p>This building was erected in 1617 and was originally the meat market. It is now used by the Central District Government (Junta Municipal del Distrito de Centro).</p>,,,,,,
,,,,,,,,,,,,,,,,,,,,,,
,Monasterio de las Descalzas Reales,TT_MADRID020-021MONDE,madrid,TRUE,monasterio_las_descalzas_reales_grand_staircase_madrid_robert_harding_817_121491,817-121491,Robert Harding,Sergio Pitamitz,"Main staircase, Real Monasterior de las Descalzas Reales, Madrid, Spain",&#169;Robert Harding Picture Library/age fotostock/Sergio Pitamitz,,gallery,,,Grand Staircase,"<p>Nothing prepares visitors for this extraordinary sight. The Grand Staircase belongs to the original palace, but the dazzling frescoes and <em>trompel&rsquo;oeil</em>, covering walls, arches and balustrades, were added in the 17th century.</p>",,,,,,
,Monasterio de las Descalzas Reales,TT_MADRID020MONDE_005,madrid,TRUE,monasterio_las_descalzas_reales_upper_cloister_madrid_alamy_ap3km9,AP3KM9,Alamy,Danita Delimont/Sergio Pitamitz,"Spain, Madrid, Real Monasterio de las Descalzas Reales. High Cloister.",&#169;Alamy Images/Danita Delimont/Sergio Pitamitz,,gallery,,,Upper Cloister,<p>The tiny chapels surrounding the cloister were rooms of the original palace. Outstanding among the 16th and 17th century works of art is a wooden polychrome <em>Recumbent Christ</em> by Gaspar Becerra.</p>,,,,,,
,Monasterio de las Descalzas Reales,TT_MADRID020MONDE_007,madrid,TRUE,monasterio_las_descalzas_reales_candil_nfuneral_roommadrid_alamy_a8ba2a,A8BA2A,Alamy,Sergio Pitamitz,Spain Madrid Real Monasterio de las Descalzas Reales,&#169;Alamy Images/Sergio Pitamitz,,gallery,,,Candilón (Funeral Room),"<p>By tradition, when a nun died her body was placed on the tiled bier, while prayers were said under the light of a large lamp (<em>candil</em>). The royal portraits include two of Felipe II&rsquo;s children and Juana of Austria, both by the 17th-century artist Alonso S&aacute;nchez Coello.</p>",,,,,,
,Monasterio de las Descalzas Reales,,madrid,TRUE,monasterio_las_descalzas_reales_fa_ade_madrid_dk_al578687,AL578687,dk,,,&#169;dkimages,,gallery,,,Façade,"<p>As well as being one of Madrid&rsquo;s most important religious sights, it is also a rare example of 16th-century architecture in the city.</p>",,,,,,
,,,,,,,,,,,,,,,,,,,,,,
,El Rastro,TT_MADRID022ELRAS_001,madrid,TRUE,rastro_calle_ribera_curtidores_madrid_alamy_dbpw1n,DBPW1N,Alamy,Anastasiya Piatrova,"MADRID, SPAIN - APRIL 21: Leather slippers and sandals on famous flea market El Rastro on April 21, 2013 in Madrid, Spain.",&#169;Alamy Images/Anastasiya Piatrova,,gallery,,,Calle Ribera de Curtidores,"<p>The Rastro&rsquo;s main street is named after the <em>curtidores</em> (tanners) who once plied their trade here. You can still pick up a leather jacket on one of the dozens of stalls, as well as T shirts, belts, handbags and hats.</p>",,,,,,
,El Rastro,TT_MADRID022ELRAS_003,madrid,TRUE,rastro_plaza_del_general_vara_rey_madrid_dk_al202784,AL202784,dk,,,&#169;dkimages,,gallery,,,Plaza del General Vara de Rey,"<p>Second-hand clothes, candelabras, books and old furniture are on offer on this bustling square.</p>",,,,,,
,El Rastro,TT_MADRID022ELRAS_010,madrid,TRUE,rastro_puerta_toledo_madrid_dk_al203047,AL203047,dk,,,&#169;dkimages,,gallery,,,Puerta de Toledo,<p>This triumphal arch was unveiled in 1827 and dedicated to Fernando VII. Ironically it had first been proposed during the French occupation to extol the values of liberty and democracy.</p>,,,,,,
,,,,,,,,,,,,,,,,,,,,,,
,Parque del Retiro,TT_MADRID032PARDEL_004,madrid,TRUE,parque_del_retiro_paseo_las_estatuas_madrid_dk_al202806,AL202806,dk,,,&#169;dkimages,,gallery,,,Paseo de las Estatuas,"<p>This line of Baroque statues, representing the kings and queens of Spain, other Iberian rulers and Aztec chief, Montezuma, was intended to impress.</p>",,,,,,
,Parque del Retiro,TT_MADRID032PARDEL_007,madrid,TRUE,parque_del_retiro_fuente_la_alcachofa_madrid_dk_al202805,AL202805,dk,,,&#169;dkimages,,gallery,,,Fuente de la Alcachofa,"<p>The &ldquo;artichoke fountain&rdquo; was designed by Ventura Rodr&iacute;guez, and is made of Sierra de Guadarrama granite and Colmenar stone. The arti&shy;choke at the top is supported by four cherubs.</p>",,,,,,
,Parque del Retiro,TT_MADRID032PARDEL_008,madrid,TRUE,parque_del_retiro_palacio_cristal_madrid_dk_al202802,AL202802,dk,,,&#169;dkimages,,gallery,,,Palacio de Cristal,"<p>Mirrored in a lake and framed by trees, the Crystal Palace was inspired by its British namesake in 1887.</p>",,,,,,
,Parque del Retiro,TT_MADRID032PARDEL_001,madrid,TRUE,parque_del_retiro_puerta_la_independencia_madrid_dk_al202880,AL202880,dk,,,&#169;dkimages,,gallery,,,Puerta de la Independencia,"<p>The handsome Independence Gate does not rightfully belong here. It was designed by Antonio L&oacute;pez Aguado as the entrance to a palace built by Fernando VII for his second wife, Isabel de Bragan&ccedil;a.</p>",,,,,,
,,,,,,,,,,,,,,,,,,,,,,
,Museo de América,TT_MADRID034MUSDE_001,madrid,TRUE,museo_america_caciques_statue_madrid_dk_11083191,11083191,dk,,,&#169;dkimages,,gallery,,,Caciques Statue,"Forged in Colombia more than 1,000 years ago, this superb statuette in area 4 (cabinet 4.23) is part of the Quimbayas treasure. The fabulous array of gold objects includes earrings, crowns and musical instruments.",,,,,,to be ordered from archive
,Museo de América,TT_MADRID034MUSDE_002,madrid,, ,,,,,,,gallery,,,Mayan Funerary Urn,"This painted baked clay urn (cabinet 2.25) dates from AD 600–900, the zenith of the Mayan civilization of Central America. The face on the lid represents the deceased.",,,,,,123 euros per image
,Museo de América,TT_MADRID034MUSDE_004,madrid,, ,,,,,,,gallery,,,Huípil,"A huípil (pronounced wee-peel) is an embroidered tunic, and this one, in area 3 (cabinet 3.9), is from Guatemala and is decorated with fertility motifs. The design designates the wearer’s village, social and marital status, wealth, religious beliefs and much else besides. A woman might own two or three huípils during her life.",,,,,,123 euros per image
,Museo de América,TT_MADRID034MUSDE_005,madrid,, ,,,,,,,gallery,,,Paracas Mummy,This mummy in cabinet 4.21 was discovered in Peru and dates from between 400 BC and AD 100. Paracas tribes wrapped the bodies of the dead in woven mantles.,,,,,,123 euros per image
,Museo de América,TT_MADRID034MUSDE_003_R13,madrid,, ,,,,,,,gallery,,,Jibaro Headdress,"This stunning feather headdress (area 1) belongs to the Karajá Indians of Brazil and would have been worn during a ritual dance or other ceremonial. The Karajá are known for their artisanal flair. Less than 500-strong, sadly this small tribe is now under threat.",,,,,,123 euros per image
,,,,,,,,,,,,,,,,,,,,,,
,Gran Vía,EWTG 52,madrid,,gran_via_museo_chicote_madrid_dk_al578859,AL578859,dk,,,&#169;dkimages,,gallery,,,The Museo Chicote,,,,,,,
,Gran Vía,,madrid,,gran_via_rounded_art_deco_madrid_dk_al1045981,AL1045981,dk,,,&#169;dkimages,"Note: Not the same building. We could get away with calling this an expressionist building, I reckon, but it's definitely not art deco.",gallery,,,The Rounded Art Deco,,,,,,,
,Gran Vía,,madrid,,gran_via_behind_gran_penas_madrid_dk_al578713,AL578713,dk,,,&#169;dkimages,,gallery,,,Behind La Gran Peña’s,,,,,,,
,Gran Vía,,madrid,,gran_via_edificio_estrella_madrid_glow_50001452,50001452,Glow,Irene Alastruey,Madrid - Gran Via,&#169;Glow Images/Irene Alastruey,,gallery,,,Edificio la Estrella,,,,,,,
,Gran Vía,,madrid,,gran_via_today_s_gran_via_madrid_dk_al578845,AL578845,dk,,,&#169;dkimages,,gallery,,,Today’s Gran Vía,,,,,,,